{
  "id": "pw-so-d2-clean",
  "title": "SO(2) exact proper rotation",
  "kind": "pairwise",
  "tags": [
    "SO",
    "batch"
  ],
  "problem": {
    "transform": {
      "group": "SO",
      "translation": false,
      "scaling": "none"
    },
    "loss": "squared_l2",
    "source": [
      [
        -0.9975688623483918,
        -0.975563986299302
      ],
      [
        -0.40668502619714103,
        0.01175578742154965
      ],
      [
        0.0008346525879874762,
        -0.3568722293094641
      ],
      [
        0.4154053681975426,
        0.6071643158862514
      ],
      [
        -0.8955603749117564,
        0.2481568239627628
      ],
      [
        -0.1736231368788444,
        0.27507191902083983
      ],
      [
        -0.42634655271235905,
        0.5405624162108877
      ],
      [
        0.040120344010277954,
        0.3461344711906071
      ],
      [
        2.006955855965606,
        -0.38956161287000357
      ],
      [
        -0.3597130163561586,
        0.30626317491611255
      ],
      [
        1.1114154532837872,
        -0.8513899307537663
      ],
      [
        0.5011084714501097,
        1.9987207161369587
      ],
      [
        -0.27732704015524073,
        -0.3013849754675295
      ],
      [
        0.553237513798369,
        -0.1505887864665573
      ],
      [
        -0.6612221041899503,
        0.3714795580314031
      ]
    ],
    "target": [
      [
        -1.3936120666153278,
        -0.06865955341687918
      ],
      [
        -0.29660258066614575,
        0.2784920433568121
      ],
      [
        -0.23603492999778417,
        -0.26766769793568757
      ],
      [
        0.713566227660081,
        0.17897867234929732
      ],
      [
        -0.5057501485321299,
        0.7796325940153479
      ],
      [
        0.05245916970876603,
        0.3210258397807321
      ],
      [
        0.039358899123533506,
        0.6873354245848593
      ],
      [
        0.25956847015771656,
        0.2324713389858777
      ],
      [
        1.243842616015337,
        -1.6224936377689252
      ],
      [
        -0.06614220527333553,
        0.46777750600827667
      ],
      [
        0.2672810925460701,
        -1.3742888857712154
      ],
      [
        1.7005238739961055,
        1.1637064729747706
      ],
      [
        -0.40743897361958425,
        -0.041673413762849575
      ],
      [
        0.3142281616680826,
        -0.47959294375331296
      ],
      [
        -0.24856960126079236,
        0.7165367306939978
      ]
    ],
    "row_weights": [
      1.0,
      1.0,
      1.0,
      1.0,
      1.0,
      1.0,
      1.0,
      1.0,
      1.0,
      1.0,
      1.0,
      1.0,
      1.0,
      1.0,
      1.0
    ],
    "views": [
      {
        "name": "source",
        "matrix": [
          [
            -0.9975688623483918,
            -0.975563986299302
          ],
          [
            -0.40668502619714103,
            0.01175578742154965
          ],
          [
            0.0008346525879874762,
            -0.3568722293094641
          ],
          [
            0.4154053681975426,
            0.6071643158862514
          ],
          [
            -0.8955603749117564,
            0.2481568239627628
          ],
          [
            -0.1736231368788444,
            0.27507191902083983
          ],
          [
            -0.42634655271235905,
            0.5405624162108877
          ],
          [
            0.040120344010277954,
            0.3461344711906071
          ],
          [
            2.006955855965606,
            -0.38956161287000357
          ],
          [
            -0.3597130163561586,
            0.30626317491611255
          ],
          [
            1.1114154532837872,
            -0.8513899307537663
          ],
          [
            0.5011084714501097,
            1.9987207161369587
          ],
          [
            -0.27732704015524073,
            -0.3013849754675295
          ],
          [
            0.553237513798369,
            -0.1505887864665573
          ],
          [
            -0.6612221041899503,
            0.3714795580314031
          ]
        ]
      },
      {
        "name": "target",
        "matrix": [
          [
            -1.3936120666153278,
            -0.06865955341687918
          ],
          [
            -0.29660258066614575,
            0.2784920433568121
          ],
          [
            -0.23603492999778417,
            -0.26766769793568757
          ],
          [
            0.713566227660081,
            0.17897867234929732
          ],
          [
            -0.5057501485321299,
            0.7796325940153479
          ],
          [
            0.05245916970876603,
            0.3210258397807321
          ],
          [
            0.039358899123533506,
            0.6873354245848593
          ],
          [
            0.25956847015771656,
            0.2324713389858777
          ],
          [
            1.243842616015337,
            -1.6224936377689252
          ],
          [
            -0.06614220527333553,
            0.46777750600827667
          ],
          [
            0.2672810925460701,
            -1.3742888857712154
          ],
          [
            1.7005238739961055,
            1.1637064729747706
          ],
          [
            -0.40743897361958425,
            -0.041673413762849575
          ],
          [
            0.3142281616680826,
            -0.47959294375331296
          ],
          [
            -0.24856960126079236,
            0.7165367306939978
          ]
        ]
      }
    ]
  },
  "expected": {
    "numerical_status": "exact",
    "optimality_status": "exact_closed_form",
    "objective": 3.552713678800501e-15,
    "objective_atol": 1e-12,
    "objective_rtol": 0.0,
    "scale": 1.0,
    "translation": [
      0.0,
      0.0
    ],
    "rotation": [
      [
        0.7484869275719467,
        -0.6631495451660261
      ],
      [
        0.663149545166026,
        0.7484869275719468
      ]
    ],
    "rotation_compare": "polar",
    "effective_rank": 2,
    "transform_unique": true,
    "objective_unique": true,
    "unidentified_subspace_dimension": 0,
    "gamma": 15.825879285152798,
    "a": 15.825879285152798,
    "b": 15.825879285152801
  }
}
