{
  "id": "law-gower-energy",
  "title": "Gower energy identity: total = consensus + residual",
  "kind": "law",
  "tags": [
    "gower",
    "decomposition"
  ],
  "problem": {
    "transform": {
      "group": "none"
    },
    "views": [
      {
        "name": "A1",
        "matrix": [
          [
            -0.1308461100558849,
            -0.1604699840678664
          ],
          [
            -0.1070329254189591,
            -0.2139101015357152
          ],
          [
            -0.14897515000299721,
            0.7129509693805324
          ],
          [
            0.36896927351652586,
            1.7579366416370823
          ],
          [
            0.501852564060781,
            1.7720188668436132
          ]
        ]
      },
      {
        "name": "A2",
        "matrix": [
          [
            -0.084737151241433,
            -0.24336285477846853
          ],
          [
            -0.09094876574647813,
            -0.18264893044739805
          ],
          [
            -0.09869100765988659,
            0.6674810616888384
          ],
          [
            0.38943275410924216,
            1.7137875263421343
          ],
          [
            0.3812734261323496,
            1.8733900212254142
          ]
        ]
      },
      {
        "name": "A3",
        "matrix": [
          [
            -0.27232489085215694,
            -0.0731941938914984
          ],
          [
            -0.0635372064001139,
            -0.38930633764457356
          ],
          [
            -0.21270764166486775,
            1.0570533485159892
          ],
          [
            0.42562999925784706,
            1.8042559889925092
          ],
          [
            0.26902494957340944,
            1.686700514879199
          ]
        ]
      }
    ],
    "configuration_weights": [
      1.0,
      1.0,
      1.0
    ]
  },
  "expected": {
    "numerical_status": "exact",
    "optimality_status": "not_applicable",
    "a": 22.307512789462884,
    "b": 22.10053520303991,
    "objective": 0.20697758642297848,
    "objective_atol": 1e-12,
    "laws": [
      "sum_i ||Yi||^2 = K||M||^2 + sum_i ||Yi-M||^2"
    ]
  }
}
