{
  "id": "gower-1975-published-history",
  "title": "Gower 1975 Table 2 carcass scores and Table 5 successive Sr",
  "kind": "gower_history",
  "citation": "Gower, J. C. (1975). Psychometrika 40:33-51, Tables 2 and 5.",
  "tags": [
    "gower",
    "historical",
    "transcribed"
  ],
  "problem": {
    "transform": {
      "group": "similarity",
      "translation": true,
      "scaling": "gower"
    },
    "views": [
      {
        "name": "judge_1",
        "matrix": [
          [
            47.0,
            44.0,
            49.0,
            38.0,
            35.0,
            40.0,
            40.0
          ],
          [
            72.0,
            45.0,
            41.0,
            77.0,
            72.0,
            73.0,
            35.0
          ],
          [
            61.0,
            49.0,
            40.0,
            58.0,
            58.0,
            62.0,
            30.0
          ],
          [
            66.0,
            56.0,
            45.0,
            55.0,
            53.0,
            46.0,
            30.0
          ],
          [
            37.0,
            72.0,
            50.0,
            27.0,
            30.0,
            33.0,
            25.0
          ],
          [
            76.0,
            76.0,
            53.0,
            81.0,
            79.0,
            75.0,
            45.0
          ],
          [
            64.0,
            59.0,
            51.0,
            72.0,
            61.0,
            66.0,
            40.0
          ],
          [
            21.0,
            70.0,
            43.0,
            27.0,
            22.0,
            26.0,
            20.0
          ],
          [
            71.0,
            70.0,
            34.0,
            72.0,
            72.0,
            71.0,
            35.0
          ]
        ],
        "ids": [
          1,
          2,
          3,
          4,
          5,
          6,
          7,
          8,
          9
        ]
      },
      {
        "name": "judge_2",
        "matrix": [
          [
            31.0,
            39.0,
            33.0,
            29.0,
            48.0,
            38.0,
            42.0
          ],
          [
            30.0,
            60.0,
            36.0,
            22.0,
            36.0,
            34.0,
            39.0
          ],
          [
            27.0,
            55.0,
            30.0,
            18.0,
            28.0,
            22.0,
            42.0
          ],
          [
            48.0,
            52.0,
            53.0,
            27.0,
            21.0,
            30.0,
            31.0
          ],
          [
            20.0,
            55.0,
            28.0,
            22.0,
            33.0,
            27.0,
            35.0
          ],
          [
            21.0,
            42.0,
            31.0,
            46.0,
            76.0,
            33.0,
            42.0
          ],
          [
            30.0,
            52.0,
            53.0,
            35.0,
            44.0,
            30.0,
            44.0
          ],
          [
            5.0,
            57.0,
            53.0,
            12.0,
            13.0,
            6.0,
            31.0
          ],
          [
            55.0,
            63.0,
            53.0,
            77.0,
            79.0,
            57.0,
            49.0
          ]
        ],
        "ids": [
          1,
          2,
          3,
          4,
          5,
          6,
          7,
          8,
          9
        ]
      },
      {
        "name": "judge_3",
        "matrix": [
          [
            43.0,
            46.0,
            44.0,
            22.0,
            53.0,
            44.0,
            29.0
          ],
          [
            53.0,
            79.0,
            75.0,
            79.0,
            73.0,
            52.0,
            27.0
          ],
          [
            22.0,
            85.0,
            83.0,
            19.0,
            27.0,
            17.0,
            22.0
          ],
          [
            28.0,
            89.0,
            78.0,
            13.0,
            29.0,
            20.0,
            24.0
          ],
          [
            75.0,
            86.0,
            85.0,
            34.0,
            75.0,
            55.0,
            38.0
          ],
          [
            53.0,
            79.0,
            82.0,
            72.0,
            78.0,
            74.0,
            38.0
          ],
          [
            15.0,
            85.0,
            85.0,
            46.0,
            75.0,
            52.0,
            35.0
          ],
          [
            5.0,
            95.0,
            95.0,
            3.0,
            20.0,
            2.0,
            24.0
          ],
          [
            27.0,
            78.0,
            85.0,
            89.0,
            92.0,
            81.0,
            41.0
          ]
        ],
        "ids": [
          1,
          2,
          3,
          4,
          5,
          6,
          7,
          8,
          9
        ]
      }
    ]
  },
  "expected": {
    "numerical_status": "exact",
    "optimality_status": "not_applicable",
    "laws": [
      "successive residual sums of squares must match Table 5 within published rounding when the 1975 rotation-then-scale schedule is followed",
      "Gower stops when successive Sr differ by less than 0.0001 after the scaling step",
      "Sr increased slightly after rotation steps 6 and 7 in the published path; Gower attributes that to 1975 numerical inaccuracy"
    ],
    "published_sr": {
      "criterion": "Sr",
      "initial": 0.661438,
      "with_scaling": [
        {
          "iteration": 1,
          "after_rotation": 0.657312,
          "after_scaling": 0.616714
        },
        {
          "iteration": 2,
          "after_rotation": 0.61662,
          "after_scaling": 0.604215
        },
        {
          "iteration": 3,
          "after_rotation": 0.604201,
          "after_scaling": 0.600456
        },
        {
          "iteration": 4,
          "after_rotation": 0.600452,
          "after_scaling": 0.599322
        },
        {
          "iteration": 5,
          "after_rotation": 0.599322,
          "after_scaling": 0.598978
        },
        {
          "iteration": 6,
          "after_rotation": 0.59898,
          "after_scaling": 0.598875
        },
        {
          "iteration": 7,
          "after_rotation": 0.598877,
          "after_scaling": 0.598842
        }
      ],
      "without_scaling": [
        {
          "iteration": 0,
          "after_rotation": 0.661438
        },
        {
          "iteration": 1,
          "after_rotation": 0.657312
        },
        {
          "iteration": 2,
          "after_rotation": 0.657158
        },
        {
          "iteration": 3,
          "after_rotation": 0.657137
        }
      ]
    }
  },
  "notes": "Transcribed from Table 2 (9 carcasses x 7 characters, three judges) and Table 5 (successive Sr). Table 1 in the paper is the ANOVA layout, not the coordinates. gpa() uses consensus-first BCD and need not reproduce Gower's 1975 iteration path."
}
