{
  "id": "pw-o2-angle-4",
  "title": "O(2) noisy rotation angle 3.14",
  "kind": "pairwise",
  "tags": [
    "O",
    "batch"
  ],
  "problem": {
    "transform": {
      "group": "O",
      "translation": false,
      "scaling": "none"
    },
    "loss": "squared_l2",
    "source": [
      [
        0.4327774276638397,
        -1.5594305997663187
      ],
      [
        0.2792916105334888,
        0.973533282243358
      ],
      [
        -1.2761751939587285,
        0.5347048346533705
      ],
      [
        -0.5075539565916306,
        -2.162098711058907
      ],
      [
        1.20588233580065,
        -0.21263274727331546
      ],
      [
        -1.758203271332053,
        0.09501746839598911
      ],
      [
        -1.0500260272849526,
        1.0614297309543852
      ]
    ],
    "target": [
      [
        -0.4623098978993099,
        1.5656840350680101
      ],
      [
        -0.2556591748068433,
        -0.9565566647444809
      ],
      [
        1.2722255603460069,
        -0.5412197246076835
      ],
      [
        0.517207543050995,
        2.166375647309189
      ],
      [
        -1.217870237239316,
        0.2075692664849091
      ],
      [
        1.771062720191305,
        -0.10135092339772145
      ],
      [
        1.0620725136464126,
        -1.0650684746103167
      ]
    ],
    "row_weights": [
      1.0,
      1.0,
      1.0,
      1.0,
      1.0,
      1.0,
      1.0
    ],
    "views": [
      {
        "name": "source",
        "matrix": [
          [
            0.4327774276638397,
            -1.5594305997663187
          ],
          [
            0.2792916105334888,
            0.973533282243358
          ],
          [
            -1.2761751939587285,
            0.5347048346533705
          ],
          [
            -0.5075539565916306,
            -2.162098711058907
          ],
          [
            1.20588233580065,
            -0.21263274727331546
          ],
          [
            -1.758203271332053,
            0.09501746839598911
          ],
          [
            -1.0500260272849526,
            1.0614297309543852
          ]
        ]
      },
      {
        "name": "target",
        "matrix": [
          [
            -0.4623098978993099,
            1.5656840350680101
          ],
          [
            -0.2556591748068433,
            -0.9565566647444809
          ],
          [
            1.2722255603460069,
            -0.5412197246076835
          ],
          [
            0.517207543050995,
            2.166375647309189
          ],
          [
            -1.217870237239316,
            0.2075692664849091
          ],
          [
            1.771062720191305,
            -0.10135092339772145
          ],
          [
            1.0620725136464126,
            -1.0650684746103167
          ]
        ]
      }
    ]
  },
  "expected": {
    "numerical_status": "exact",
    "optimality_status": "exact_closed_form",
    "objective": 0.002332168975058835,
    "objective_atol": 1e-12,
    "objective_rtol": 0.0,
    "scale": 1.0,
    "translation": [
      0.0,
      0.0
    ],
    "rotation": [
      [
        -0.9999968897848716,
        -0.0024940771005884026
      ],
      [
        0.0024940771005883522,
        -0.9999968897848716
      ]
    ],
    "rotation_compare": "polar",
    "effective_rank": 2,
    "transform_unique": true,
    "objective_unique": true,
    "unidentified_subspace_dimension": 0,
    "gamma": 16.128074342963156,
    "a": 16.0688670188781,
    "b": 16.18961383602327
  }
}
