{
  "id": "law-orthogonal-preserves-norms",
  "title": "O(d) action preserves Frobenius norms and pairwise distances",
  "kind": "law",
  "tags": [
    "law",
    "O"
  ],
  "problem": {
    "transform": {
      "group": "O"
    },
    "source": [
      [
        0.96716881040068,
        1.600899889391941
      ],
      [
        0.21850446405515003,
        1.1443090084399936
      ],
      [
        -1.4228148545856127,
        0.12414522359944838
      ],
      [
        0.966998113226062,
        0.9315884897201294
      ],
      [
        0.029859009937268095,
        2.2579735789678845
      ],
      [
        1.4683307045441174,
        0.45990539304471717
      ],
      [
        0.5857301717169147,
        1.236863653746105
      ],
      [
        1.0396464024931222,
        -1.8178793258457298
      ]
    ]
  },
  "expected": {
    "numerical_status": "exact",
    "optimality_status": "not_applicable",
    "laws": [
      "||XR||_F = ||X||_F",
      "row-wise Euclidean distances are preserved"
    ]
  }
}
