{
  "id": "pw-sim-translation",
  "title": "Similarity with translation only",
  "kind": "pairwise",
  "tags": [
    "similarity",
    "translation"
  ],
  "problem": {
    "transform": {
      "group": "similarity",
      "translation": true,
      "scaling": "none",
      "rotation_group": "SO"
    },
    "loss": "squared_l2",
    "source": [
      [
        0.96716881040068,
        1.600899889391941
      ],
      [
        0.21850446405515003,
        1.1443090084399936
      ],
      [
        -1.4228148545856127,
        0.12414522359944838
      ],
      [
        0.966998113226062,
        0.9315884897201294
      ],
      [
        0.029859009937268095,
        2.2579735789678845
      ],
      [
        1.4683307045441174,
        0.45990539304471717
      ],
      [
        0.5857301717169147,
        1.236863653746105
      ],
      [
        1.0396464024931222,
        -1.8178793258457298
      ]
    ],
    "target": [
      [
        4.771059532663345,
        -1.398631481178727
      ],
      [
        3.904305535121834,
        -1.265548635540131
      ],
      [
        1.9917477233467211,
        -0.9884460006527009
      ],
      [
        4.3397467343245495,
        -1.9104391099391074
      ],
      [
        4.477463947357072,
        -0.2922422513566125
      ],
      [
        4.419320456375906,
        -2.594169563821247
      ],
      [
        4.24480058813916,
        -1.4313322342649513
      ],
      [
        2.62405541351174,
        -4.060149400758204
      ]
    ],
    "row_weights": [
      1.0,
      1.0,
      1.0,
      1.0,
      1.0,
      1.0,
      1.0,
      1.0
    ],
    "views": [
      {
        "name": "source",
        "matrix": [
          [
            0.96716881040068,
            1.600899889391941
          ],
          [
            0.21850446405515003,
            1.1443090084399936
          ],
          [
            -1.4228148545856127,
            0.12414522359944838
          ],
          [
            0.966998113226062,
            0.9315884897201294
          ],
          [
            0.029859009937268095,
            2.2579735789678845
          ],
          [
            1.4683307045441174,
            0.45990539304471717
          ],
          [
            0.5857301717169147,
            1.236863653746105
          ],
          [
            1.0396464024931222,
            -1.8178793258457298
          ]
        ]
      },
      {
        "name": "target",
        "matrix": [
          [
            4.771059532663345,
            -1.398631481178727
          ],
          [
            3.904305535121834,
            -1.265548635540131
          ],
          [
            1.9917477233467211,
            -0.9884460006527009
          ],
          [
            4.3397467343245495,
            -1.9104391099391074
          ],
          [
            4.477463947357072,
            -0.2922422513566125
          ],
          [
            4.419320456375906,
            -2.594169563821247
          ],
          [
            4.24480058813916,
            -1.4313322342649513
          ],
          [
            2.62405541351174,
            -4.060149400758204
          ]
        ]
      }
    ]
  },
  "expected": {
    "numerical_status": "exact",
    "optimality_status": "exact_closed_form",
    "objective": 0.0,
    "objective_atol": 1e-12,
    "objective_rtol": 0.0,
    "scale": 1.0,
    "translation": [
      2.9999999999999996,
      -2.0
    ],
    "rotation": [
      [
        0.7648421872844884,
        -0.6442176872376911
      ],
      [
        0.6442176872376911,
        0.7648421872844884
      ]
    ],
    "rotation_compare": "polar",
    "effective_rank": 2,
    "transform_unique": true,
    "objective_unique": true,
    "unidentified_subspace_dimension": 0,
    "gamma": 16.16024476311346,
    "a": 16.160244763113457,
    "b": 16.16024476311346
  }
}
