{
  "id": "pw-sim-huge-scale",
  "title": "Isotropic scale 1e6",
  "kind": "pairwise",
  "tags": [
    "similarity",
    "scale",
    "extreme"
  ],
  "problem": {
    "transform": {
      "group": "similarity",
      "translation": false,
      "scaling": "isotropic",
      "rotation_group": "O"
    },
    "loss": "squared_l2",
    "source": [
      [
        0.96716881040068,
        1.600899889391941
      ],
      [
        0.21850446405515003,
        1.1443090084399936
      ],
      [
        -1.4228148545856127,
        0.12414522359944838
      ],
      [
        0.966998113226062,
        0.9315884897201294
      ],
      [
        0.029859009937268095,
        2.2579735789678845
      ],
      [
        1.4683307045441174,
        0.45990539304471717
      ],
      [
        0.5857301717169147,
        1.236863653746105
      ],
      [
        1.0396464024931222,
        -1.8178793258457298
      ]
    ],
    "target": [
      [
        1771059.5326633444,
        601368.518821273
      ],
      [
        904305.535121834,
        734451.364459869
      ],
      [
        -1008252.2766532789,
        1011553.9993472991
      ],
      [
        1339746.73432455,
        89560.89006089252
      ],
      [
        1477463.9473570718,
        1707757.7486433876
      ],
      [
        1419320.4563759058,
        -594169.5638212468
      ],
      [
        1244800.58813916,
        568667.7657350488
      ],
      [
        -375944.58648825967,
        -2060149.4007582045
      ]
    ],
    "row_weights": [
      1.0,
      1.0,
      1.0,
      1.0,
      1.0,
      1.0,
      1.0,
      1.0
    ],
    "views": [
      {
        "name": "source",
        "matrix": [
          [
            0.96716881040068,
            1.600899889391941
          ],
          [
            0.21850446405515003,
            1.1443090084399936
          ],
          [
            -1.4228148545856127,
            0.12414522359944838
          ],
          [
            0.966998113226062,
            0.9315884897201294
          ],
          [
            0.029859009937268095,
            2.2579735789678845
          ],
          [
            1.4683307045441174,
            0.45990539304471717
          ],
          [
            0.5857301717169147,
            1.236863653746105
          ],
          [
            1.0396464024931222,
            -1.8178793258457298
          ]
        ]
      },
      {
        "name": "target",
        "matrix": [
          [
            1771059.5326633444,
            601368.518821273
          ],
          [
            904305.535121834,
            734451.364459869
          ],
          [
            -1008252.2766532789,
            1011553.9993472991
          ],
          [
            1339746.73432455,
            89560.89006089252
          ],
          [
            1477463.9473570718,
            1707757.7486433876
          ],
          [
            1419320.4563759058,
            -594169.5638212468
          ],
          [
            1244800.58813916,
            568667.7657350488
          ],
          [
            -375944.58648825967,
            -2060149.4007582045
          ]
        ]
      }
    ]
  },
  "expected": {
    "numerical_status": "exact",
    "optimality_status": "exact_closed_form",
    "objective": 0.00390625,
    "objective_atol": 1e-12,
    "objective_rtol": 0.0,
    "scale": 1000000.0,
    "translation": [
      0.0,
      0.0
    ],
    "rotation": [
      [
        0.7648421872844884,
        -0.644217687237691
      ],
      [
        0.6442176872376909,
        0.7648421872844885
      ]
    ],
    "rotation_compare": "polar",
    "effective_rank": 2,
    "transform_unique": true,
    "objective_unique": true,
    "unidentified_subspace_dimension": 0,
    "gamma": 22423545.573231794,
    "a": 22.423545573231795,
    "b": 22423545573231.797
  }
}
