{
  "id": "pw-sim-scale-translation",
  "title": "Similarity with isotropic scale and translation",
  "kind": "pairwise",
  "tags": [
    "similarity",
    "scale",
    "translation"
  ],
  "problem": {
    "transform": {
      "group": "similarity",
      "translation": true,
      "scaling": "isotropic",
      "rotation_group": "SO"
    },
    "loss": "squared_l2",
    "source": [
      [
        0.96716881040068,
        1.600899889391941
      ],
      [
        0.21850446405515003,
        1.1443090084399936
      ],
      [
        -1.4228148545856127,
        0.12414522359944838
      ],
      [
        0.966998113226062,
        0.9315884897201294
      ],
      [
        0.029859009937268095,
        2.2579735789678845
      ],
      [
        1.4683307045441174,
        0.45990539304471717
      ],
      [
        0.5857301717169147,
        1.236863653746105
      ],
      [
        1.0396464024931222,
        -1.8178793258457298
      ]
    ],
    "target": [
      [
        10.96976789698505,
        0.7061583346957283
      ],
      [
        7.069374908048253,
        1.3050311400694108
      ],
      [
        -1.5371352449397548,
        2.551992997062846
      ],
      [
        9.028860304460474,
        -1.5969759947259836
      ],
      [
        9.648587763106823,
        5.684909868895244
      ],
      [
        9.386942053691577,
        -4.673763037195611
      ],
      [
        8.60160264662622,
        0.55900494580772
      ],
      [
        1.3082493608028314,
        -11.27067230341192
      ]
    ],
    "row_weights": [
      1.0,
      1.0,
      1.0,
      1.0,
      1.0,
      1.0,
      1.0,
      1.0
    ],
    "views": [
      {
        "name": "source",
        "matrix": [
          [
            0.96716881040068,
            1.600899889391941
          ],
          [
            0.21850446405515003,
            1.1443090084399936
          ],
          [
            -1.4228148545856127,
            0.12414522359944838
          ],
          [
            0.966998113226062,
            0.9315884897201294
          ],
          [
            0.029859009937268095,
            2.2579735789678845
          ],
          [
            1.4683307045441174,
            0.45990539304471717
          ],
          [
            0.5857301717169147,
            1.236863653746105
          ],
          [
            1.0396464024931222,
            -1.8178793258457298
          ]
        ]
      },
      {
        "name": "target",
        "matrix": [
          [
            10.96976789698505,
            0.7061583346957283
          ],
          [
            7.069374908048253,
            1.3050311400694108
          ],
          [
            -1.5371352449397548,
            2.551992997062846
          ],
          [
            9.028860304460474,
            -1.5969759947259836
          ],
          [
            9.648587763106823,
            5.684909868895244
          ],
          [
            9.386942053691577,
            -4.673763037195611
          ],
          [
            8.60160264662622,
            0.55900494580772
          ],
          [
            1.3082493608028314,
            -11.27067230341192
          ]
        ]
      }
    ]
  },
  "expected": {
    "numerical_status": "exact",
    "optimality_status": "exact_closed_form",
    "objective": 1.1368683772161603e-13,
    "objective_atol": 1e-12,
    "objective_rtol": 0.0,
    "scale": 4.5,
    "translation": [
      3.0000000000000004,
      -2.0000000000000004
    ],
    "rotation": [
      [
        0.7648421872844885,
        -0.6442176872376908
      ],
      [
        0.6442176872376908,
        0.7648421872844884
      ]
    ],
    "rotation_compare": "polar",
    "effective_rank": 2,
    "transform_unique": true,
    "objective_unique": true,
    "unidentified_subspace_dimension": 0,
    "gamma": 72.72110143401056,
    "a": 16.160244763113457,
    "b": 327.2449564530477
  }
}
