{
  "id": "pw-so1-flip",
  "title": "Pairwise SO(1) cannot reflect; residual is 4||X||^2 after centering",
  "kind": "pairwise",
  "tags": [
    "d1",
    "SO",
    "reflection"
  ],
  "problem": {
    "transform": {
      "group": "SO",
      "translation": false,
      "scaling": "none"
    },
    "loss": "squared_l2",
    "source": [
      [
        1.0
      ],
      [
        2.0
      ],
      [
        3.0
      ],
      [
        4.0
      ]
    ],
    "target": [
      [
        -1.0
      ],
      [
        -2.0
      ],
      [
        -3.0
      ],
      [
        -4.0
      ]
    ],
    "row_weights": [
      1.0,
      1.0,
      1.0,
      1.0
    ],
    "views": [
      {
        "name": "source",
        "matrix": [
          [
            1.0
          ],
          [
            2.0
          ],
          [
            3.0
          ],
          [
            4.0
          ]
        ]
      },
      {
        "name": "target",
        "matrix": [
          [
            -1.0
          ],
          [
            -2.0
          ],
          [
            -3.0
          ],
          [
            -4.0
          ]
        ]
      }
    ]
  },
  "expected": {
    "numerical_status": "exact",
    "optimality_status": "exact_closed_form",
    "objective": 20.0,
    "objective_atol": 1e-12,
    "objective_rtol": 0.0,
    "scale": 1.0,
    "translation": [
      0.0
    ],
    "rotation": [
      [
        1.0
      ]
    ],
    "rotation_compare": "polar",
    "effective_rank": 1,
    "transform_unique": true,
    "objective_unique": true,
    "unidentified_subspace_dimension": 0,
    "gamma": -5.0,
    "a": 5.0,
    "b": 5.0
  },
  "notes": "SO(1)={+1}. O(1) chooses -1. This is the sharp d=1 divergence."
}
