{
  "id": "pw-rank0-zeros",
  "title": "Rank-zero (all zeros) configurations",
  "kind": "pairwise",
  "tags": [
    "rank",
    "degenerate"
  ],
  "problem": {
    "transform": {
      "group": "O",
      "translation": false,
      "scaling": "none"
    },
    "loss": "squared_l2",
    "source": [
      [
        0.0,
        0.0,
        0.0
      ],
      [
        0.0,
        0.0,
        0.0
      ],
      [
        0.0,
        0.0,
        0.0
      ],
      [
        0.0,
        0.0,
        0.0
      ],
      [
        0.0,
        0.0,
        0.0
      ]
    ],
    "target": [
      [
        0.0,
        0.0,
        0.0
      ],
      [
        0.0,
        0.0,
        0.0
      ],
      [
        0.0,
        0.0,
        0.0
      ],
      [
        0.0,
        0.0,
        0.0
      ],
      [
        0.0,
        0.0,
        0.0
      ]
    ],
    "row_weights": [
      1.0,
      1.0,
      1.0,
      1.0,
      1.0
    ],
    "views": [
      {
        "name": "source",
        "matrix": [
          [
            0.0,
            0.0,
            0.0
          ],
          [
            0.0,
            0.0,
            0.0
          ],
          [
            0.0,
            0.0,
            0.0
          ],
          [
            0.0,
            0.0,
            0.0
          ],
          [
            0.0,
            0.0,
            0.0
          ]
        ]
      },
      {
        "name": "target",
        "matrix": [
          [
            0.0,
            0.0,
            0.0
          ],
          [
            0.0,
            0.0,
            0.0
          ],
          [
            0.0,
            0.0,
            0.0
          ],
          [
            0.0,
            0.0,
            0.0
          ],
          [
            0.0,
            0.0,
            0.0
          ]
        ]
      }
    ]
  },
  "expected": {
    "numerical_status": "exact",
    "optimality_status": "exact_closed_form",
    "objective": 0.0,
    "objective_atol": 1e-12,
    "objective_rtol": 0.0,
    "scale": 1.0,
    "translation": [
      0.0,
      0.0,
      0.0
    ],
    "rotation": [
      [
        1.0,
        0.0,
        0.0
      ],
      [
        0.0,
        1.0,
        0.0
      ],
      [
        0.0,
        0.0,
        1.0
      ]
    ],
    "rotation_compare": "polar",
    "effective_rank": 0,
    "transform_unique": false,
    "objective_unique": true,
    "unidentified_subspace_dimension": 3,
    "gamma": 0.0,
    "a": 0.0,
    "b": 0.0
  }
}
