{
  "id": "id-connected-partial",
  "title": "Partial overlap that still connects three views",
  "kind": "identifiability",
  "tags": [
    "overlap"
  ],
  "problem": {
    "transform": {
      "group": "O"
    },
    "views": [
      {
        "name": "A",
        "matrix": [
          [
            -0.2213062739740948,
            -1.0067858385249857
          ],
          [
            1.5162225079389113,
            0.0002337219769908025
          ],
          [
            -0.22149450765704054,
            0.7282308878185696
          ]
        ],
        "ids": [
          "a",
          "b",
          "c"
        ]
      },
      {
        "name": "B",
        "matrix": [
          [
            -0.49603361722470873,
            0.6234963973184701
          ],
          [
            0.12460183781879848,
            -0.5089218803984319
          ],
          [
            -1.2000114536240936,
            -0.46175438710503897
          ]
        ],
        "ids": [
          "c",
          "d",
          "e"
        ]
      },
      {
        "name": "C",
        "matrix": [
          [
            1.162561189735197,
            0.4634046222824883
          ],
          [
            -0.9149429193827765,
            0.24053228522697315
          ],
          [
            0.8238837683852539,
            1.4393714774410682
          ]
        ],
        "ids": [
          "e",
          "f",
          "a"
        ]
      }
    ]
  },
  "expected": {
    "numerical_status": "exact",
    "optimality_status": "not_applicable",
    "connected_components": 1
  }
}
