{
  "id": "pw-zero-one-config-weight",
  "title": "A single zero configuration weight drops that view",
  "kind": "pairwise",
  "tags": [
    "weights"
  ],
  "problem": {
    "transform": {
      "group": "O"
    },
    "views": [
      {
        "name": "keep",
        "matrix": [
          [
            0.96716881040068,
            1.600899889391941
          ],
          [
            0.21850446405515003,
            1.1443090084399936
          ],
          [
            -1.4228148545856127,
            0.12414522359944838
          ],
          [
            0.966998113226062,
            0.9315884897201294
          ],
          [
            0.029859009937268095,
            2.2579735789678845
          ],
          [
            1.4683307045441174,
            0.45990539304471717
          ],
          [
            0.5857301717169147,
            1.236863653746105
          ],
          [
            1.0396464024931222,
            -1.8178793258457298
          ]
        ]
      },
      {
        "name": "drop",
        "matrix": [
          [
            1.7710595326633445,
            0.601368518821273
          ],
          [
            0.904305535121834,
            0.734451364459869
          ],
          [
            -1.0082522766532789,
            1.011553999347299
          ],
          [
            1.33974673432455,
            0.08956089006089252
          ],
          [
            1.4774639473570719,
            1.7077577486433875
          ],
          [
            1.4193204563759059,
            -0.5941695638212469
          ],
          [
            1.2448005881391602,
            0.5686677657350488
          ],
          [
            -0.3759445864882597,
            -2.0601494007582044
          ]
        ]
      }
    ],
    "configuration_weights": [
      1.0,
      0.0
    ]
  },
  "expected": {
    "numerical_status": "exact",
    "optimality_status": "exact_closed_form",
    "laws": [
      "zero configuration weight removes that view from the consensus"
    ]
  }
}
